No.,Articles,Date
1,166-Million-Year-Old Dinosaur Footprints Unearthed In England,2025-02-20
2,The Goodyear Blimp Turns 100!,2025-02-20
3,"Humpback Whale Accidentally Swallows Kayaker, Then Spits Him Out",2025-02-20
4,A Plastic That Fully Decomposes In Soil And Seawater,2025-02-20
5,"Winnie-the-Pooh Collection Auctions For Over $100,000",2025-02-20
6,Boom Supersonic's XB-1 Breaks Sound Barrier In Two Historic Test Flights,2025-02-20
7,Seabound Aims To Cut Cargo Ship Emissions With Pebbles,2025-02-20
8,Unique Valentine's Day Celebrations From Around The World,2025-02-20
9,Yosemite’s Firefall Is A Rare Natural Spectacle,2025-02-20
10,The World's Largest Iceberg Is On The Move Again!,2025-02-20
11,Super Bowl Sunday — America's Second Biggest Food Holiday,2025-02-20
12,A Little Red Swedish House Is Heading To The Moon,2025-02-20
13,Legendary Groundhog Predicts Six More Weeks Of Winter,2025-02-20
